{
  "schema_version": 1,
  "date": "2026-11-03",
  "day_number": 12,
  "revision": "v24-november-02-03-complete-1",
  "publication_status": "scheduled",
  "editorial_note": "V23 diversity requirements + complete, source-scoped member banks; 2026-10-23 through 2026-11-01 days are unchanged. Future date remains API-gated.",
  "questions": {
    "q1": {
      "id": "closeish_20261103_q1",
      "date": "2026-11-03",
      "day_number": 12,
      "topic": "world-architecture",
      "bank_id": "ctbuh-2024-world-50-tallest-buildings",
      "question_family": "ctbuh-2024-world-50-tallest-buildings",
      "prompt": "Name one of the 50 tallest completed buildings in 2024 standing at least 450 m tall.",
      "metric": "Architectural height in metres of a ranked completed building in 2024",
      "unit": "m",
      "limit": 450,
      "direction": "above",
      "comparison": "at_least",
      "time_limit_seconds": 30,
      "boundary_inclusive": true,
      "input_max_length": 180,
      "score_bands": [
        {
          "max_gap_inclusive": 4,
          "points": 1000,
          "tier": "RAZOR EDGE"
        },
        {
          "max_gap_inclusive": 14,
          "points": 800,
          "tier": "CLOSE CALL"
        },
        {
          "max_gap_inclusive": 40,
          "points": 600,
          "tier": "SOLID HIT"
        },
        {
          "max_gap_inclusive": 95,
          "points": 400,
          "tier": "IN THE ZONE"
        },
        {
          "max_gap_inclusive": 195,
          "points": 200,
          "tier": "ON THE BOARD"
        }
      ],
      "scoring_window": {
        "max_scoring_distance": 195,
        "units": "m",
        "outside_window_points": 0,
        "wrong_side_points": 0,
        "exact_match_points": 1200
      },
      "source": "https://www.skyscrapercenter.com/buildings/?function=all&location=world&material=all&status=completed&year=2024",
      "source_refs": [
        "ctbuh-2024-world-50-tallest-buildings-source"
      ],
      "verification_status": "source_list_completely_enumerated",
      "editorial_status": "complete_checked_scheduled",
      "content_revision": "v24-20261026-nov02-nov03-1",
      "metric_provenance": "Exactly the first 50 entries of the CTBUH historical 2024 tallest completed buildings list; twin towers count separately.",
      "measurement_snapshot": "Pinned source list; complete CSV: content/source-snapshots/v24-2026-11-03-q1-ctbuh-2024-world-50-tallest-buildings.csv",
      "measurement": {
        "property": "Architectural height in metres of a ranked completed building in 2024",
        "numeric_rule": "Architectural CTBUH height (spire included, antenna excluded), reported to nearest metre in published list.",
        "unit": "m",
        "time_dependent": true,
        "source_urls": [
          "https://www.skyscrapercenter.com/buildings/?function=all&location=world&material=all&status=completed&year=2024"
        ]
      },
      "answer_scope": {
        "type": "source_defined_finite_named_universe",
        "coverage": "complete_for_exact_prompt_universe",
        "claimed_exhaustive": true,
        "entity_scope": "Exactly the first 50 entries of the CTBUH historical 2024 tallest completed buildings list; twin towers count separately.",
        "dataset_count": 50,
        "known_unmeasured_count": 0,
        "note": "Every member of the explicitly bounded source list is included, including wrong-side and zero-point entries. No examples-only selection."
      },
      "scoring_policy": "Category membership verified first; then measured value and one-sided backend bands. Wrong side and beyond window return zero.",
      "perfect_tier": {
        "points": 1200,
        "tier": "PERFECT HIT",
        "rule": "exact metric_value == limit"
      },
      "approach_rule": {
        "required_side": "from_above",
        "operator": ">=",
        "exact_target_allowed": true,
        "wrong_side_points": 0,
        "exact_target_points": 1200
      },
      "answers": [
        {
          "entity_id": "ctbuh-2024-world-50-tallest-buildings-001",
          "canonical": "Burj Khalifa",
          "aliases": [],
          "verified_status": "source_row_or_rounded_source_value",
          "source_refs": [
            {
              "source_id": "ctbuh-2024-world-50-tallest-buildings-source",
              "locator": "row-001"
            }
          ],
          "metric_value": 828,
          "points": 0,
          "tier": "TOO FAR",
          "source_evidence": {
            "rule": "Architectural CTBUH height (spire included, antenna excluded), reported to nearest metre in published list."
          }
        },
        {
          "entity_id": "ctbuh-2024-world-50-tallest-buildings-002",
          "canonical": "Menara Merdeka Maybank",
          "aliases": [
            {
              "input": "Merdeka 118",
              "kind": "documented_variant",
              "action": "accept"
            }
          ],
          "verified_status": "source_row_or_rounded_source_value",
          "source_refs": [
            {
              "source_id": "ctbuh-2024-world-50-tallest-buildings-source",
              "locator": "row-002"
            }
          ],
          "metric_value": 679,
          "points": 0,
          "tier": "TOO FAR",
          "source_evidence": {
            "rule": "Architectural CTBUH height (spire included, antenna excluded), reported to nearest metre in published list."
          }
        },
        {
          "entity_id": "ctbuh-2024-world-50-tallest-buildings-003",
          "canonical": "Shanghai Tower",
          "aliases": [],
          "verified_status": "source_row_or_rounded_source_value",
          "source_refs": [
            {
              "source_id": "ctbuh-2024-world-50-tallest-buildings-source",
              "locator": "row-003"
            }
          ],
          "metric_value": 632,
          "points": 200,
          "tier": "ON THE BOARD",
          "source_evidence": {
            "rule": "Architectural CTBUH height (spire included, antenna excluded), reported to nearest metre in published list."
          }
        },
        {
          "entity_id": "ctbuh-2024-world-50-tallest-buildings-004",
          "canonical": "Makkah Royal Clock Tower",
          "aliases": [],
          "verified_status": "source_row_or_rounded_source_value",
          "source_refs": [
            {
              "source_id": "ctbuh-2024-world-50-tallest-buildings-source",
              "locator": "row-004"
            }
          ],
          "metric_value": 601,
          "points": 200,
          "tier": "ON THE BOARD",
          "source_evidence": {
            "rule": "Architectural CTBUH height (spire included, antenna excluded), reported to nearest metre in published list."
          }
        },
        {
          "entity_id": "ctbuh-2024-world-50-tallest-buildings-005",
          "canonical": "Ping An Finance Center",
          "aliases": [],
          "verified_status": "source_row_or_rounded_source_value",
          "source_refs": [
            {
              "source_id": "ctbuh-2024-world-50-tallest-buildings-source",
              "locator": "row-005"
            }
          ],
          "metric_value": 599,
          "points": 200,
          "tier": "ON THE BOARD",
          "source_evidence": {
            "rule": "Architectural CTBUH height (spire included, antenna excluded), reported to nearest metre in published list."
          }
        },
        {
          "entity_id": "ctbuh-2024-world-50-tallest-buildings-006",
          "canonical": "Lotte World Tower",
          "aliases": [],
          "verified_status": "source_row_or_rounded_source_value",
          "source_refs": [
            {
              "source_id": "ctbuh-2024-world-50-tallest-buildings-source",
              "locator": "row-006"
            }
          ],
          "metric_value": 555,
          "points": 200,
          "tier": "ON THE BOARD",
          "source_evidence": {
            "rule": "Architectural CTBUH height (spire included, antenna excluded), reported to nearest metre in published list."
          }
        },
        {
          "entity_id": "ctbuh-2024-world-50-tallest-buildings-007",
          "canonical": "One World Trade Center",
          "aliases": [],
          "verified_status": "source_row_or_rounded_source_value",
          "source_refs": [
            {
              "source_id": "ctbuh-2024-world-50-tallest-buildings-source",
              "locator": "row-007"
            }
          ],
          "metric_value": 541,
          "points": 400,
          "tier": "IN THE ZONE",
          "source_evidence": {
            "rule": "Architectural CTBUH height (spire included, antenna excluded), reported to nearest metre in published list."
          }
        },
        {
          "entity_id": "ctbuh-2024-world-50-tallest-buildings-008",
          "canonical": "Guangzhou CTF Finance Centre",
          "aliases": [],
          "verified_status": "source_row_or_rounded_source_value",
          "source_refs": [
            {
              "source_id": "ctbuh-2024-world-50-tallest-buildings-source",
              "locator": "row-008"
            }
          ],
          "metric_value": 530,
          "points": 400,
          "tier": "IN THE ZONE",
          "source_evidence": {
            "rule": "Architectural CTBUH height (spire included, antenna excluded), reported to nearest metre in published list."
          }
        },
        {
          "entity_id": "ctbuh-2024-world-50-tallest-buildings-009",
          "canonical": "Tianjin CTF Finance Centre",
          "aliases": [],
          "verified_status": "source_row_or_rounded_source_value",
          "source_refs": [
            {
              "source_id": "ctbuh-2024-world-50-tallest-buildings-source",
              "locator": "row-009"
            }
          ],
          "metric_value": 530,
          "points": 400,
          "tier": "IN THE ZONE",